{"$schema":"https://json-schema.org/draft/2020-12/schema","$id":"https://equivista.net/schemas/batch19-continuity-attestation.schema.json","title":"EquiVista Batch 19 Offline Continuity Attestation","type":"object","additionalProperties":false,"required":["version","batch","mode","status","recovery_contract_version","attestation_contract_version","approved_batch18_recovery_hash","rejection_codes","safety","fixtures","evidence_ref"],"properties":{"version":{"const":1},"batch":{"const":19},"mode":{"const":"offline-continuity-attestation"},"status":{"const":"in-progress"},"recovery_contract_version":{"const":"archive-recovery-v1"},"attestation_contract_version":{"const":"continuity-attestation-v1"},"approved_batch18_recovery_hash":{"type":"string","pattern":"^[a-f0-9]{64}$"},"rejection_codes":{"type":"array","uniqueItems":true},"safety":{"type":"object"},"fixtures":{"type":"array","minItems":6},"evidence_ref":{"type":"string","pattern":"^docs/"}}}
