{"version":1,"batch":19,"mode":"offline-continuity-attestation","status":"in-progress","recovery_contract_version":"archive-recovery-v1","attestation_contract_version":"continuity-attestation-v1","approved_batch18_recovery_hash":"ddd1acf2068a45abe5d88c1778e085e5ee5c4e62c22b054a5ad74a52099960ad","rejection_codes":["invalid-input","recovery-unpinned","objectives-failed","findings-open","signoff-incomplete","followup-invalid","mutation-enabled"],"safety":{"fail_closed":true,"recovery_pinned":true,"independent_signoff_required":true,"production_data_allowed":false,"protected_access_allowed":false,"deployment_authorized":false,"database_changes":false,"cohort_changes":false},"fixtures":[{"fixture_ref":"attestation-synthetic-ready","expected_decision":"attested","input":{"batch18_recovery":{"recovery_contract_version":"archive-recovery-v1","archive_hash":"691071505b91bd3b25646e13c7133164f59ead5d107b9015c4456fd26257b7cb","recovery_plan":{"drill_ref":"drill-synthetic-archive-recovery","mode":"offline-tabletop","requested_hashes":["1111111111111111111111111111111111111111111111111111111111111111","2222222222222222222222222222222222222222222222222222222222222222","3333333333333333333333333333333333333333333333333333333333333333"],"operators":[{"operator_ref":"operator-synthetic-records","role":"records-manager","approved":true,"evidence_ref":"operator-evidence-synthetic-records"},{"operator_ref":"operator-synthetic-audit","role":"audit-reviewer","approved":true,"evidence_ref":"operator-evidence-synthetic-audit"}],"recovered_objects":[{"content_hash":"1111111111111111111111111111111111111111111111111111111111111111","recomputed_hash":"1111111111111111111111111111111111111111111111111111111111111111","method":"sha256-recompute","verified":true},{"content_hash":"2222222222222222222222222222222222222222222222222222222222222222","recomputed_hash":"2222222222222222222222222222222222222222222222222222222222222222","method":"sha256-recompute","verified":true},{"content_hash":"3333333333333333333333333333333333333333333333333333333333333333","recomputed_hash":"3333333333333333333333333333333333333333333333333333333333333333","method":"sha256-recompute","verified":true}],"duration_minutes":30,"external_download":false,"destructive_restore":false,"writeback":false,"production_mount":false,"deployment_authorized":false},"release_authorized":false,"recovery_hash":"ddd1acf2068a45abe5d88c1778e085e5ee5c4e62c22b054a5ad74a52099960ad"},"attestation":{"rto_target_minutes":60,"rto_observed_minutes":30,"rpo_target_objects":0,"rpo_observed_objects":0,"open_critical_findings":0,"signoffs":[{"signer_ref":"signer-synthetic-continuity","role":"continuity-owner","approved":true,"evidence_ref":"attestation-evidence-synthetic-continuity"},{"signer_ref":"signer-synthetic-audit","role":"audit-reviewer","approved":true,"evidence_ref":"attestation-evidence-synthetic-audit"}],"next_drill_days":90,"production_access":false,"deployment_authorized":false,"writeback":false}}},{"fixture_ref":"attestation-synthetic-recovery","expected_decision":"invalid","expected_code":"recovery-unpinned","input":{"source_fixture_ref":"attestation-synthetic-ready","mutation":"recovery"}},{"fixture_ref":"attestation-synthetic-objective","expected_decision":"invalid","expected_code":"objectives-failed","input":{"source_fixture_ref":"attestation-synthetic-ready","mutation":"objective"}},{"fixture_ref":"attestation-synthetic-finding","expected_decision":"invalid","expected_code":"findings-open","input":{"source_fixture_ref":"attestation-synthetic-ready","mutation":"finding"}},{"fixture_ref":"attestation-synthetic-signoff","expected_decision":"invalid","expected_code":"signoff-incomplete","input":{"source_fixture_ref":"attestation-synthetic-ready","mutation":"signoff"}},{"fixture_ref":"attestation-synthetic-followup","expected_decision":"invalid","expected_code":"followup-invalid","input":{"source_fixture_ref":"attestation-synthetic-ready","mutation":"followup"}},{"fixture_ref":"attestation-synthetic-mutation","expected_decision":"invalid","expected_code":"mutation-enabled","input":{"source_fixture_ref":"attestation-synthetic-ready","mutation":"mutation"}}],"evidence_ref":"docs/BATCH_19_CONTINUITY_ATTESTATION.md"}
